{
  "event_type": "kaizen.pattern_detected",
  "cluster_id": "cluster-fact-missing-citations",
  "category": "fact_validation",
  "severity": "warning",
  "occurrence_count": 43,
  "window": "24h",
  "recommendation": "Tighten prompt scaffolding to require citations for all externally asserted claims.",
  "created_at": "2026-04-24T12:00:00Z"
}
